[
  {
    "caseId": "rc6-001-valid-low-risk-allow-01",
    "datasetId": "release-1-candidate",
    "datasetVersion": "1.0.0-rc6-pending",
    "entityType": "human",
    "workflowType": "regulated_approval",
    "signalType": "evidence_quality",
    "evidenceMode": "synthetic_fixture",
    "evidenceReferences": [
      "fixture:release-1-candidate:001"
    ],
    "expectedDecision": "allow",
    "actualDecision": "allow",
    "groundTruthLabel": null,
    "reviewStatus": "pending",
    "reviewerId": null,
    "reviewerRole": null,
    "reviewTimestamp": null,
    "reviewerConfidence": null,
    "rationale": null,
    "provenance": "Internally authored deterministic synthetic product-behavior fixture",
    "licenceBoundary": "Cyber Sentinels internal test use; no third-party or personal data",
    "limitations": [
      "Product-behavior fixture only",
      "Requires accountable human review before metric eligibility"
    ],
    "rulesetVersion": "trust-rules:rc6-v1",
    "providerVersions": {
      "hopae_connect": "not_called"
    },
    "createdAt": "2026-07-16T00:00:00.000Z",
    "updatedAt": "2026-07-16T00:00:00.000Z"
  },
  {
    "caseId": "rc6-002-valid-low-risk-allow-02",
    "datasetId": "release-1-candidate",
    "datasetVersion": "1.0.0-rc6-pending",
    "entityType": "ai_agent",
    "workflowType": "regulated_approval",
    "signalType": "authority",
    "evidenceMode": "synthetic_fixture",
    "evidenceReferences": [
      "fixture:release-1-candidate:002"
    ],
    "expectedDecision": "allow",
    "actualDecision": "allow",
    "groundTruthLabel": null,
    "reviewStatus": "pending",
    "reviewerId": null,
    "reviewerRole": null,
    "reviewTimestamp": null,
    "reviewerConfidence": null,
    "rationale": null,
    "provenance": "Internally authored deterministic synthetic product-behavior fixture",
    "licenceBoundary": "Cyber Sentinels internal test use; no third-party or personal data",
    "limitations": [
      "Product-behavior fixture only",
      "Requires accountable human review before metric eligibility"
    ],
    "rulesetVersion": "trust-rules:rc6-v1",
    "providerVersions": {
      "hopae_connect": "not_called"
    },
    "createdAt": "2026-07-16T00:00:00.000Z",
    "updatedAt": "2026-07-16T00:00:00.000Z"
  },
  {
    "caseId": "rc6-003-step-up-required-01",
    "datasetId": "release-1-candidate",
    "datasetVersion": "1.0.0-rc6-pending",
    "entityType": "human",
    "workflowType": "payment_approval",
    "signalType": "session_change",
    "evidenceMode": "synthetic_fixture",
    "evidenceReferences": [
      "fixture:release-1-candidate:003"
    ],
    "expectedDecision": "step_up",
    "actualDecision": "step_up",
    "groundTruthLabel": null,
    "reviewStatus": "pending",
    "reviewerId": null,
    "reviewerRole": null,
    "reviewTimestamp": null,
    "reviewerConfidence": null,
    "rationale": null,
    "provenance": "Internally authored deterministic synthetic product-behavior fixture",
    "licenceBoundary": "Cyber Sentinels internal test use; no third-party or personal data",
    "limitations": [
      "Product-behavior fixture only",
      "Requires accountable human review before metric eligibility"
    ],
    "rulesetVersion": "trust-rules:rc6-v1",
    "providerVersions": {
      "hopae_connect": "not_called"
    },
    "createdAt": "2026-07-16T00:00:00.000Z",
    "updatedAt": "2026-07-16T00:00:00.000Z"
  },
  {
    "caseId": "rc6-004-step-up-required-02",
    "datasetId": "release-1-candidate",
    "datasetVersion": "1.0.0-rc6-pending",
    "entityType": "ai_agent",
    "workflowType": "data_export",
    "signalType": "risk_change",
    "evidenceMode": "synthetic_fixture",
    "evidenceReferences": [
      "fixture:release-1-candidate:004"
    ],
    "expectedDecision": "step_up",
    "actualDecision": "step_up",
    "groundTruthLabel": null,
    "reviewStatus": "pending",
    "reviewerId": null,
    "reviewerRole": null,
    "reviewTimestamp": null,
    "reviewerConfidence": null,
    "rationale": null,
    "provenance": "Internally authored deterministic synthetic product-behavior fixture",
    "licenceBoundary": "Cyber Sentinels internal test use; no third-party or personal data",
    "limitations": [
      "Product-behavior fixture only",
      "Requires accountable human review before metric eligibility"
    ],
    "rulesetVersion": "trust-rules:rc6-v1",
    "providerVersions": {
      "hopae_connect": "not_called"
    },
    "createdAt": "2026-07-16T00:00:00.000Z",
    "updatedAt": "2026-07-16T00:00:00.000Z"
  },
  {
    "caseId": "rc6-005-human-review-required-01",
    "datasetId": "release-1-candidate",
    "datasetVersion": "1.0.0-rc6-pending",
    "entityType": "human",
    "workflowType": "identity_review",
    "signalType": "provider_conflict",
    "evidenceMode": "synthetic_fixture",
    "evidenceReferences": [
      "fixture:release-1-candidate:005"
    ],
    "expectedDecision": "review",
    "actualDecision": "review",
    "groundTruthLabel": null,
    "reviewStatus": "pending",
    "reviewerId": null,
    "reviewerRole": null,
    "reviewTimestamp": null,
    "reviewerConfidence": null,
    "rationale": null,
    "provenance": "Internally authored deterministic synthetic product-behavior fixture",
    "licenceBoundary": "Cyber Sentinels internal test use; no third-party or personal data",
    "limitations": [
      "Product-behavior fixture only",
      "Requires accountable human review before metric eligibility"
    ],
    "rulesetVersion": "trust-rules:rc6-v1",
    "providerVersions": {
      "hopae_connect": "not_called"
    },
    "createdAt": "2026-07-16T00:00:00.000Z",
    "updatedAt": "2026-07-16T00:00:00.000Z"
  },
  {
    "caseId": "rc6-006-human-review-required-02",
    "datasetId": "release-1-candidate",
    "datasetVersion": "1.0.0-rc6-pending",
    "entityType": "workflow",
    "workflowType": "hiring_security",
    "signalType": "uncertainty",
    "evidenceMode": "synthetic_fixture",
    "evidenceReferences": [
      "fixture:release-1-candidate:006"
    ],
    "expectedDecision": "review",
    "actualDecision": "review",
    "groundTruthLabel": null,
    "reviewStatus": "pending",
    "reviewerId": null,
    "reviewerRole": null,
    "reviewTimestamp": null,
    "reviewerConfidence": null,
    "rationale": null,
    "provenance": "Internally authored deterministic synthetic product-behavior fixture",
    "licenceBoundary": "Cyber Sentinels internal test use; no third-party or personal data",
    "limitations": [
      "Product-behavior fixture only",
      "Requires accountable human review before metric eligibility"
    ],
    "rulesetVersion": "trust-rules:rc6-v1",
    "providerVersions": {
      "hopae_connect": "not_called"
    },
    "createdAt": "2026-07-16T00:00:00.000Z",
    "updatedAt": "2026-07-16T00:00:00.000Z"
  },
  {
    "caseId": "rc6-007-expired-authority-01",
    "datasetId": "release-1-candidate",
    "datasetVersion": "1.0.0-rc6-pending",
    "entityType": "ai_agent",
    "workflowType": "payment_approval",
    "signalType": "authority_expiry",
    "evidenceMode": "synthetic_fixture",
    "evidenceReferences": [
      "fixture:release-1-candidate:007"
    ],
    "expectedDecision": "block",
    "actualDecision": "block",
    "groundTruthLabel": null,
    "reviewStatus": "pending",
    "reviewerId": null,
    "reviewerRole": null,
    "reviewTimestamp": null,
    "reviewerConfidence": null,
    "rationale": null,
    "provenance": "Internally authored deterministic synthetic product-behavior fixture",
    "licenceBoundary": "Cyber Sentinels internal test use; no third-party or personal data",
    "limitations": [
      "Product-behavior fixture only",
      "Requires accountable human review before metric eligibility"
    ],
    "rulesetVersion": "trust-rules:rc6-v1",
    "providerVersions": {
      "hopae_connect": "not_called"
    },
    "createdAt": "2026-07-16T00:00:00.000Z",
    "updatedAt": "2026-07-16T00:00:00.000Z"
  },
  {
    "caseId": "rc6-008-expired-authority-02",
    "datasetId": "release-1-candidate",
    "datasetVersion": "1.0.0-rc6-pending",
    "entityType": "machine_identity",
    "workflowType": "data_export",
    "signalType": "credential_expiry",
    "evidenceMode": "synthetic_fixture",
    "evidenceReferences": [
      "fixture:release-1-candidate:008"
    ],
    "expectedDecision": "block",
    "actualDecision": "block",
    "groundTruthLabel": null,
    "reviewStatus": "pending",
    "reviewerId": null,
    "reviewerRole": null,
    "reviewTimestamp": null,
    "reviewerConfidence": null,
    "rationale": null,
    "provenance": "Internally authored deterministic synthetic product-behavior fixture",
    "licenceBoundary": "Cyber Sentinels internal test use; no third-party or personal data",
    "limitations": [
      "Product-behavior fixture only",
      "Requires accountable human review before metric eligibility"
    ],
    "rulesetVersion": "trust-rules:rc6-v1",
    "providerVersions": {
      "hopae_connect": "not_called"
    },
    "createdAt": "2026-07-16T00:00:00.000Z",
    "updatedAt": "2026-07-16T00:00:00.000Z"
  },
  {
    "caseId": "rc6-009-revoked-authority-01",
    "datasetId": "release-1-candidate",
    "datasetVersion": "1.0.0-rc6-pending",
    "entityType": "ai_agent",
    "workflowType": "regulated_approval",
    "signalType": "authority_revocation",
    "evidenceMode": "synthetic_fixture",
    "evidenceReferences": [
      "fixture:release-1-candidate:009"
    ],
    "expectedDecision": "block",
    "actualDecision": "block",
    "groundTruthLabel": null,
    "reviewStatus": "pending",
    "reviewerId": null,
    "reviewerRole": null,
    "reviewTimestamp": null,
    "reviewerConfidence": null,
    "rationale": null,
    "provenance": "Internally authored deterministic synthetic product-behavior fixture",
    "licenceBoundary": "Cyber Sentinels internal test use; no third-party or personal data",
    "limitations": [
      "Product-behavior fixture only",